{
  "type": "object",
  "additionalProperties": false,
  "required": [
    "schema_version",
    "dataset_id",
    "content_version",
    "ruleset_id",
    "scope",
    "description",
    "source_catalog",
    "parameters"
  ],
  "properties": {
    "schema_version": {
      "const": 1
    },
    "dataset_id": {
      "const": "effects.deluxe2015.one_small_step"
    },
    "content_version": {
      "const": "0.1.0"
    },
    "ruleset_id": {
      "const": "ruleset.deluxe2015"
    },
    "scope": {
      "const": "release-candidate"
    },
    "description": {
      "type": "string",
      "minLength": 1
    },
    "source_catalog": {
      "type": "array",
      "minItems": 3,
      "maxItems": 3,
      "prefixItems": [
        {
          "type": "object",
          "additionalProperties": false,
          "required": [
            "id",
            "url",
            "edition",
            "description"
          ],
          "properties": {
            "id": {
              "const": "C-DELUXE-EN"
            },
            "url": {
              "const": "https://www.gmtgames.com/nnts/TS_Cards_Deluxe.pdf"
            },
            "edition": {
              "const": "English Deluxe card images"
            },
            "description": {
              "type": "string",
              "minLength": 1
            }
          }
        },
        {
          "type": "object",
          "additionalProperties": false,
          "required": [
            "id",
            "url",
            "edition",
            "description"
          ],
          "properties": {
            "id": {
              "const": "R2015"
            },
            "url": {
              "const": "https://www.gmtgames.com/nnts/TS_Rules-2015.pdf"
            },
            "edition": {
              "const": "Deluxe rules 2015"
            },
            "description": {
              "type": "string",
              "minLength": 1
            }
          }
        },
        {
          "type": "object",
          "additionalProperties": false,
          "required": [
            "id",
            "url",
            "edition",
            "description"
          ],
          "properties": {
            "id": {
              "const": "PROJECT-OSS"
            },
            "url": {
              "const": null
            },
            "edition": {
              "const": "Scoped design, 2026-10-12"
            },
            "description": {
              "type": "string",
              "minLength": 1
            }
          }
        }
      ],
      "items": false
    },
    "parameters": {
      "type": "object",
      "additionalProperties": false,
      "required": [
        "one_small_step"
      ],
      "properties": {
        "one_small_step": {
          "$ref": "#/$defs/one_small_step"
        }
      }
    }
  },
  "$schema": "https://json-schema.org/draft/2020-12/schema",
  "$id": "urn:coldwarheat:contract:one-small-step:1",
  "title": "一小步：落后门禁、事件推进两格、仅目标格VP、共享领先能力与越终点待裁定。",
  "description": "一小步：落后门禁、事件推进两格、仅目标格VP、共享领先能力与越终点待裁定。",
  "$defs": {
    "one_small_step": {
      "type": "object",
      "additionalProperties": false,
      "required": [
        "card_id",
        "effect_id",
        "description",
        "template",
        "beneficiary",
        "activation_gate",
        "advance_steps",
        "ordinary_attempt_consumption",
        "ordinary_attempt_reset",
        "requires_ordinary_ops_qualification",
        "random_roll",
        "track_dataset_id",
        "victory_dataset_id",
        "reward_policy",
        "intermediate_reward_policy",
        "ability_policy",
        "overflow_policy",
        "state_validation_policy",
        "idempotency_policy",
        "proposal_policy",
        "root_slot_policy",
        "terminal_policy",
        "source_refs"
      ],
      "properties": {
        "card_id": {
          "const": "card.one_small_step"
        },
        "effect_id": {
          "const": "effect.one_small_step"
        },
        "description": {
          "type": "string",
          "minLength": 1
        },
        "template": {
          "const": "ConditionalTwoStepSpaceAdvance"
        },
        "beneficiary": {
          "const": "EffectController"
        },
        "activation_gate": {
          "type": "object",
          "additionalProperties": false,
          "required": [
            "checkpoint",
            "condition",
            "not_met"
          ],
          "properties": {
            "checkpoint": {
              "const": "EventResolution"
            },
            "condition": {
              "const": "BeneficiaryStrictlyBehindOpponent"
            },
            "not_met": {
              "const": "BlockedPrerequisite"
            }
          }
        },
        "advance_steps": {
          "const": 2
        },
        "ordinary_attempt_consumption": {
          "const": 0
        },
        "ordinary_attempt_reset": {
          "const": false
        },
        "requires_ordinary_ops_qualification": {
          "const": false
        },
        "random_roll": {
          "const": "None"
        },
        "track_dataset_id": {
          "const": "rules.deluxe2015.space-race"
        },
        "victory_dataset_id": {
          "const": "rules.deluxe2015.victory"
        },
        "reward_policy": {
          "const": "DestinationOnlyNormalFirstOrSecond"
        },
        "intermediate_reward_policy": {
          "const": "SuppressVpAndRecordReach"
        },
        "ability_policy": {
          "const": "QueryAuthoritativeFinalTrackPositions"
        },
        "overflow_policy": {
          "const": "RequiresRulingBeforeMutation"
        },
        "state_validation_policy": {
          "const": "ValidatePositionsAttemptsTurnAndArrivalEvidenceBeforeMutation"
        },
        "idempotency_policy": {
          "const": "FullRequestDigestAndSourceFrame"
        },
        "proposal_policy": {
          "const": "ImmutableCompletePlanBeforeCommit"
        },
        "root_slot_policy": {
          "const": "NoNewRootSlot"
        },
        "terminal_policy": {
          "const": "FinalizeAcceptedWorkInWinningTransactionThenFinishedAbsorbing"
        },
        "source_refs": {
          "type": "array",
          "minItems": 3,
          "maxItems": 3,
          "prefixItems": [
            {
              "type": "object",
              "additionalProperties": false,
              "required": [
                "source_id",
                "locator",
                "verification"
              ],
              "properties": {
                "source_id": {
                  "const": "C-DELUXE-EN"
                },
                "locator": {
                  "const": "PDFp12 English #80, visually verified 2026-10-12"
                },
                "verification": {
                  "const": "Verified"
                }
              }
            },
            {
              "type": "object",
              "additionalProperties": false,
              "required": [
                "source_id",
                "locator",
                "verification"
              ],
              "properties": {
                "source_id": {
                  "const": "R2015"
                },
                "locator": {
                  "const": "§5.2/5.5; §6.4.2–6; threshold via existing victory dataset"
                },
                "verification": {
                  "const": "Verified"
                }
              }
            },
            {
              "type": "object",
              "additionalProperties": false,
              "required": [
                "source_id",
                "locator",
                "verification"
              ],
              "properties": {
                "source_id": {
                  "const": "PROJECT-OSS"
                },
                "locator": {
                  "const": "OSS-OPEN-01 crossing end; named source/validation/transaction contracts are engineering, not additional official rulings"
                },
                "verification": {
                  "const": "Verified"
                }
              }
            }
          ],
          "items": false
        }
      }
    }
  }
}
